Producto;Detalles_Inventario_Real
"Colección La Grasa";""
"Colección La Pesada";""
"Colección Los Calidosos";""
"FUTSAL ADIDAS CRAZYFAST";""
"FUTSAL GATO LUNAR AZUL X VERDE";""
"FUTSAL GATO LUNAR BLANCO";""
"FUTSAL GATO LUNAR MORADO";""
"FUTSAL GATO STREET";""
"FUTSAL GATO STREET MORA AZUL";""
"FUTSAL GATO SUPREME";""
"FUTSAL JOMA CANCHA ORIGINALES";""
"FUTSAL JOMA DRIBLING ORIGINALES";""
"FUTSAL JOMA REGATE";""
"FUTSAL JOMA REGATE REBOUND";""
"FUTSAL JOMA TOP FLEX REBOUN PINK";""
"FUTSAL JOMA TOP FLEX REBOUND";""
"FUTSAL JOMA TOP-FLEX REBOUND";""
"FUTSAL MIZUNO CLÁSICO";""
"FUTSAL NIKE GATO AGRESTE ROJO-BLANCO";""
"FUTSAL NIKE GATO LUNAR AZUL-BLANCO";""
"FUTSAL NIKE GATO STREET";""
"FUTSAL NIKE GATO STREET BEIGE SUELA GOMA";""
"FUTSAL NIKE GATO SUPREME CAFÉ";""
"FUTSAL NIKE GATO SUPREME FUCHSIA";""
"FUTSAL NIKE GATO SUPREME FUCHSIA-AZUL";""
"FUTSAL NIKE GATO SUPREME NEGRO-BLANCO";""
"FUTSAL NIKE GATO SUPREMO NEGRO CHULO AZUL";""
"FUTSAL NIKE MAGISTAX";""
"FUTSAL WAVE HURRACANE 3";""
"GUAYO ADIDAS F50 TUBULAR";""
"GUAYO ADIDAS PREDATOR 25 ELITE FT";""
"GUAYO ADIDAS PREDATOR ELITE FOLD";""
"GUAYO ADIDAS PREDATOR LE AGÜÉ AZUL-VERDE";""
"GUAYO F50 TUBULAR SPARKFUSION ELITE MORADO";""
"GUAYO NIKE HYPERVENOM 1 RGN HYDRA BLANCO AZUL";""
"GUAYO NIKE HYPERVENOM HYDRA";""
"GUAYO NIKE HYPERVENOM PHANTOM RNG";""
"GUAYO NIKE PHANTOM GX 2 ELITE FG";""
"GUAYO NIKE PHANTOM GX 2 NEGRO VERDE MENTA";""
"GUAYO NIKE PHANTOM GX 6 ELITE";""
"GUAYO NIKE PHANTOM GX 6 TACHES DE ALUMINIO";""
"GUAYO PHANTOM GX 6 ELITE";""
"GUAYO PREDATOR 26 ELITE";""
"GUAYO PREDATOR 26 ELITE FG";""
"GUAYO PREDATOR EDGE-EDICIÓN LIMITADA";""
"GUAYO PREDATOR ELITE FG BECKAM ROSA";""
"JOMA TOP FLEX LIGA 5 ORIGINALES";""
"JOMA TOP FLEX REBOUND";""
"MIZUNO 2 NEGRO-BLANCO";""
"MIZUNO HURRICANE WAVE 3";""
"TENI GUAYO ADIDAS F50 PRO TF TURF NARANJA";""
"TENI GUAYO ADIDAS PREDATOR LEAGUE NEGRO-AZUL";""
"TENI GUAYO ADIDAS PREDATOR LEAGUE ROJO-BLANCO";""
"TENI GUAYO F50 LEAGUE TUBULAR BLANCO ROJO";""
"TENI GUAYO LAMINE YAMAL MORADO ROSA";""
"TENI GUAYO NIKE MERCURIAL VAPOR 15 ACADEMY TF ROSA";""
"TENIGUAYO ADIDAS F50 NEÓN PRO";""
"TENIGUAYO ADIDAS F50 NIÑO";""
"TENIGUAYO ADIDAS F50 SPARKFUSION";""
"TENIGUAYO ADIDAS F50 TUBULAR";""
"TENIGUAYO ADIDAS F50 X LAMINE YAMAL";""
"TENIGUAYO ADIDAS NIÑO";""
"TENIGUAYO ADIDAS PREDATOR 26 ELITE";""
"TENIGUAYO ADIDAS PREDATOR 5 X BECKHAM";""
"TENIGUAYO ADIDAS PREDATOR X BAPE";""
"TENIGUAYO NIKE MERCURIAL";""
"TENIGUAYO NIKE MERCURIAL NIÑO";""
"TENIGUAYO NIKE PHANTOM GX 6 ELITE";""
"TENIGUAYO NIKE PHANTOM GX 6 ELITE EN BOTA";""
"TENIGUAYO NIKE TOTAL 90";""
"TENIGUAYO NIKE X ALEXIA PUTELLAS  PHANTOM GX 6";""
"TENIGUAYO PHANTOM GX 6 ELITE";""
